{
  "source": "git-commit",
  "source_ref": "abc1234",
  "content_seed": "Added SovereigntyProfile to Layer 0. Communities declare local/hybrid/cloud sovereignty mode.",
  "suggested_type": "text-post",
  "suggested_channels": ["x", "linkedin", "facebook"],
  "mined_at": "2026-04-13T10:00:00Z",
  "confidence": 0.85
}
